{
  "task_id": "task-admin-settings-save",
  "report_type": "touch_report",
  "touched_files": ["src/features/admin/settings/data/save.ts", "src/routes/api/admin/settings.ts"],
  "touched_interfaces": ["PUT /api/admin/settings", "interface:admin-settings-command"],
  "touched_data": ["table:admin_settings", "config:admin.settings.save"],
  "touched_workflow_steps": ["admin-settings:save", "workflow:admin-settings-review"]
}
